Source,URL,Category,Sub-Category,Region,Start Date,End Date,Description
Institute for Health Metrics and Evaluation (IHME): Global Health Data Exchange (GHDx),http://ghdx.healthdata.org/,Health,,Global,,,"This data set provides estimates for health and demographic data using Bayesian models which are informed by a range of researcher, government, and NGO data. The estimates include uncertainty and the code generating the estimates is available. Among other estimates, the database contains estimates of deaths by cause (including protein-energy malnutrition, iodine deficiency, iron-deficiency anemia, and other nutritional deficiencies). There is good documentation for the estimates, but one must be careful to know what data went into the models so as not to test an effect when non-independent data were used in the estimate. The article describing the data includes a supplementary file detailing the estimation methods and can be found here."
The World Bank: Subnational Malnutrition,http://databank.worldbank.org/data/reports.aspx?source=subnational-malnutrition-database,Health,,Global,,2012,"Database with subnational estimates of child malnutrition (prevalence for stunting, underweight, overweight, wasting and severe wasting indicators) using available data up to 2012. Data can be accessed using an API. These statistics by quintile are available in the World Bank: Health Nutrition and Population Statistics by Wealth."
World Health Organization (WHO): Mortality Database,http://www.who.int/healthinfo/mortality_data/en/,Health,,Global,,,"The WHO Mortality Database is a compilation of mortality data by age, sex and cause of death, as reported annually by Member States from their civil registration systems."
IMF Global Economic Data,https://www.imf.org/en/Data,Economic,,Global,,,A huge number of data sets for nearly anything economic related for most countries in the world.
United States Department of Labor: Bureau of Labor Statistics,http://www.bls.gov/data/,Economic,,US,,,"This database consists of economic data for the United States, including data on on inflation, prices, and time use."
EORA World MRIO,http://worldmrio.com/**,Economic,,Global,1990,2015,"This global supply chain database consists of a multi-region input-output table with matching environmental and social satellite accounts for 190 countries. The database includes over 15,000 sectors for 1990-2015 and a range of environmental indicators, including GHG emissions, air pollution, energy use, water requirements, land occupation and N and P emissions."
The World Bank: Global Consumption Database,http://datatopics.worldbank.org/consumption/,Economic,,Global,,,"This database consists of data on household consumption patterns in developing countries based on household surveys. Four levels of consumption are used to segment the market in each country: lowest, low, middle, and higher. They are based on global income distribution data, which rank the global population by income per capita. More details on the data can be found here."
Bureau of Economic Analysis,https://www.bea.gov/data/gdp,Economic,,US,,,"This database includes a range of economic data for the US, including GDP, employment by industry, price indices, and international trade."
United Nations: COMTRADE,http://comtrade.un.org/,Economic,,Global,,,"This data is maintained by the United Nations and consists of reported bilateral trade data (annually and monthly) for commodities (using HS codes). This data is publicly available when accessing a limited number of records. A subscription allows bulk downloads and access to a derived data product produced by CEPII, the BACI trade data."
Urban Emissions in India,https://urbanemissions.info/india-air-quality/india-ncap-landcover-classification/,Economic,,India,1992,2020,India Landcover classification for Indian cities using data from the European Space Agency. Data from 1992-2020 for 132 non-attainment cities.
The Commodity Flow Survey (CFS),https://www.census.gov/programs-surveys/cfs.html,Economic,,US,,,"CFS has undertaken through a partnership between the Census Bureau and the Bureau of Transportation Statistics (BTS) is conducted every 5 years as part of the Economic Census. The CFS produces data on the movement of goods in the United States. It provides information on commodities shipped, their value, weight, and mode of transportation, as well as the origin and destination of shipments of commodities from manufacturing, mining, wholesale, and selected retail and services establishments."
Database of Political Institutions (Cesi Cruz),https://www.iadb.org/en/research-and-data/dpi2020,Political,,Global,1975,2020,Institutional and electoral results data for political economy for 180 countries from 1975-2020
SPID: State policy database,https://dataverse.harvard.edu/dataverse/spid,Political,,US,1691,2022,"Harvard's Dataverse hosts policy information that diffuses across U.S. states. It contains 4 datasets which have policies from 1691, 1912, or 1960 onwards."
World Carbon Pricing Database,https://github.com/g-dolphin/WorldCarbonPricingDatabase?fbclid=IwAR2odk12BTYHPM0mefXI1b5g2GlsG1GkFUCn1tWYT2Ci3UDvWARPJMA4FLo,Political,,Global,1990,2018,"198 national jurisdictions and 98 sub-national jurisdictions (50 U.S. States, 13 Canadian Provinces and Territories, Japanese Municipalities, 32 Chinese Provinces and Municipalities from 1990 to 2018."
The Intergovernmental Panel on Climate Change (IPCC): Climate Change Projection data,https://www.ipcc-data.org/,Projection,,Global,,,The IPCC produces several projections for climate change scenarios for socioeconomic data based on different potential scenarios.
Eurostat Waste Statistics,https://ec.europa.eu/eurostat/statistics-explained/index.php?title=Waste_statistics,Waste,,Europe,,,"European country statistics on waste production, waste management, recycling, and management of hazardous waste."
IPUMS International,https://international.ipums.org/international-action/sample_details,Economic,,Global,,,"Census data from 103 countries, 547 censuses and surveys, over 1 billion person records."
USGS EarthExplorer,https://earthexplorer.usgs.gov/,GIS,,Global,1984,2022,"A collection of satellite imagery data from government satellites from various space agencies. Data can be used to track land use changes, vegetation, wildfires, weather, temperature, and several other geographic variables. "
Canada Municipal Waste Management,https://www.canada.ca/en/environment-climate-change/services/managing-reducing-waste/municipal-solid/statistics-trends.html,Waste,,Canada,1998,2020,"Biennial surveys provides comprehensive information about waste generated by Canadians, waste disposed and diverted from landfills, and their sources. This information is collected from businesses that provide waste management services."
USGS Climate Model Projections,https://data.gov/climate/portals/,Projection,,Global,,,"US climate model projections intened for data innovators, those who want to use government data to ehlp others learn of the impacts of climate change, or make decisions in which climate change change plays a role. The large projections have been downscaled to be usable on domestic computers. "
Oil Production,https://ourworldindata.org/grapher/oil-production-by-country?country=QAT~OMN~SAU~NOR~IRQ~USA~ARE~CAN,Energy,,Global,1900,2022,Global oil production by country from when each country began producing or tracking their production. 
Carbon Pricing Dashboard,https://carbonpricingdashboard.worldbank.org/,Energy,,Global,1990,2022,"Type of tax, status of taxes, and juristiction of taxes for every country. 68 carbon pricing initiatives are available in 46 countries with 36 subnational jurisdictions. These initiatives cover 23% of global emissions."
Wildfire Incidents (FAMWEB),https://wfmi.nifc.gov/fire_reporting/annual_dataset_archive/index.html,Natural Disasters,,US,1972,2017,"Wildfire incident reports from all federal agencies, as captured in FAMWEB."
ICIS-AIR,https://www.epa.gov/enviro/icis-air-overview,Pollution,,US,,,Database of U.S. state and federal EPA inspections of facility environmental air quality violations. See: Cecato (2022).
Berkeley Air Pollution Data,https://berkeleyearth.org/air-pollution-overview/,Pollution,,Global,,,Global Historical Air Quality Data
NCEP/NARR Reanalysis Data,https://psl.noaa.gov/data/reanalysis/reanalysis.shtml,Weather,,Global,,,Gridded reanalysis data (32km cells)
TerraClimate,https://climatedataguide.ucar.edu/climate-data/terraclimate-global-high-resolution-gridded-temperature-precipitation-and-other-water,Weather,,Global,,,Gridded reanalysis data (4km cells)
NCAR Climate Data Guide,https://climatedataguide.ucar.edu/,Weather,,Global,,,Meta: Climate Data Guide