Source,URL,Category,Sub-Category,Region,Start Date,End Date,Description
The World Bank: Central Microdata Catalog,http://microdata.worldbank.org/index.php/catalog/central,Household Survey,,Global,1900,2020,"This database consists of national living standards and health surveys, including access to the surveys used."
USAID: Demographic and Health Surveys (DHS),http://dhsprogram.com/Data/,Household Survey,Health,Global,1990,2020,"This is a database of survey data by country. The surveys are based on a set of model questionnaires, but are modified for each country and therefore are not identical. A description of this data is available here"
IHSN Household Survey Data,http://catalog.ihsn.org/index.php/catalog#_r=1579063770420&collection=&country=&dtype=&from=1890&page=1&ps=&sid=&sk=Climate&sort_by=rank&sort_order=desc&to=2019&topic=&view=s,Household Survey,,Global,1890,2022,"9051 datasets from the International Household Survey Network with data for most countries in the world. Datasets include census information, agriculture, energy use, pesticide use, household consumption, and much more. If you are looking for data in a developing country then IHSN is a good place to start."
"Social and Economic Well-being (RAND) (Indonesians, Malaysians, and Guatemalans)",https://www.rand.org/well-being/social-and-behavioral-policy/data/FLS/IFLS.html,Household Survey,,"Indonesia, Malaysia, Guetemala",1993,2015,"Family Life Survey for Indonesians, Malaysians, and Guatemalans."
Mexican Family Life Survey,http://www.ennvih-mxfls.org/english/,Household Survey,,Mexico,2002,2012,"Longitudinal, multithematic survey representative of the Mexican population at the national, urban, rural, and regional level. Data has been collected in three rounds: 2002, 2005-2006, and 2009-2012."
International Fertilizer Association Fertilizer Use by Crop,https://www.ifastat.org/,Agriculture,,Global,,,"This data set contains fertilizer use by crop in the main fertilizer-consuming countries. The data covers 27 countries and the EU-27, which accounts for 94% of global fertilizer consumption."
FAO CropWat,http://www.fao.org/land-water/databases-and-software/cropwat/en/,Agriculture,,Global,,,"This computer program enables the calculation of crop water requirements and irrigation requirements based on soil, climate and crop data."
Water Footprint Network Water Footprint Statistics,http://waterfootprint.org/en/resources/waterstat/,Agriculture,Water,Global,,,"This data set contains estimates for green, blue and grey water footprints of crops, derived crop products, biofuels, livestock products, and industrial products. All data are available at national and sub-national level."
United States Department of Agriculture Economic Research Service: Commodity and Food Elasticities,http://www.ers.usda.gov/data-products/commodity-and-food-elasticities/demand-elasticities-from-literature.aspx,Agriculture,,US,,,"This database consists of information and estimates on price and income elasticities for agricultural products. Most of the demand elasticities in this data product are from academic and government research conducted in the United States on consumer demand, as published in working papers, dissertations, and peer-reviewed journals and as presented at professional conferences in the United States. The most fully covered countries are the United States and China, and the greatest number of demand studies are for vegetables, fruits, and grocery products such as coffee and ketchup."
Food and Agriculture Organization (FAO): FAOSTAT,http://faostat3.fao.org/home/E,Agriculture,,Global,,,"This database provides population data and projections for each country from 1950–2100 and food production, food trade, and agriculture-related resource use data for 1961–2014. There is also a suite of food security indices. In order to provide complete spatial and temporal coverage, some data provided is interpolated or modeled. One should pay close attention to the documentation before proceeding with an analysis."
Food and Agriculture Organization (FAO) Fisheries and Aquaculture Department: FishStatJ,http://www.fao.org/fishery/statistics/software/fishstatj/en,Agriculture,Fisheries,Global,1950,2012,This database consists of productions and trade data in terms of price and quantity by country for 1950–2012. FishStat allows for multiple species and commodity grouping schemes to facilitate matching across data sources. It should be noted though that there is not complete consistency between the production by source and production and trade data sets.
Eurostat Agricultural Data,https://ec.europa.eu/eurostat/web/agriculture/data/database,Agriculture,,Europe,,,"This database contains agricultural production, agricultural environmental accounts, and economic accounts for EU nations."
Crop layers,https://nasaharvest.org/news/twenty-years-historical-us-midwestern-corn-and-soybean-information-mapped-using-satellite-data,Agriculture,,US,,,Twenty years of satellite data for maize (corn) and soybean crops throughout the Midwestern United States.
USDA Agricultural Statistics Service,https://quickstats.nass.usda.gov/,Agriculture,,US,,,"U.S. agricultural information from 1850 to current with animal & products, crops, demographics, economics, and environmental. Various geographic levels are available depending on the variable of interest."
USGS Pesticide National Synthesis Project,https://water.usgs.gov/nawqa/pnsp/usage/maps/county-level/,Agriculture,Pesticide,US,,,Estimated pesticide use from 1992 to 2019 at the state-level crop group.
USGS Nitrogen and Phosphorus from Fertilizer,https://pubs.er.usgs.gov/publication/ofr20201153,Agriculture,Fertilizer,US,,,County-level nitrogen and phosphorus from fertilizer and manure from 1950 to 2017 in conterminous U.S. Estimates are by kilograms of nitrogen and phosphorus.
Canada National Forestry Database,http://nfdp.ccfm.org/en/index.php,Forestry,,Canada,1990,2019,"The forestry database has information on harvests, replanting, fires, forest insects, pest control, revenue, stock of wood. Data is available at the national and provincial level and is available for varying years depending on the dataset (usually 1990-2019)."
USDA Forest Service,https://data.fs.usda.gov/geodata/edw/datasets.php,Forestry,,US,,,"Hundreds of datasets for a wide variety of variables available for different years. They have raster data, data sets, and models."
Global Forest Watch,https://www.globalforestwatch.org/dashboards/global/,Forestry,,Global,2001,2022,"Data for global and national level statistics of forest cover, land cover, forest change, fires, and climate for every country. Data is from 2001 onwards."
Brazil Forestry data,https://www.ibge.gov.br/en/statistics/economic/agriculture-forestry-and-fishing/18374-forestry-activities.html?=&t=o-que-e,Forestry,,Brazil,2000,2016,Data sets are posted by year and each file contains the forestry information for each state. Data is from 2000 to 2016 with additional information from 1992.
OECD Statistics,https://stats.oecd.org/,Data Sites,,Global,,,"A detailed catalog of data from the OECD countries on Agriculture and Fisheries, Demography and Population, Development, Economic Projections, Education and Training, Environment (Air and Climate, Water, Waste, Forests, Environmental Policy (Fossil Fuel Subsidies and taxes)...), Finance, Globalization, Health, Industry, Communication Abilities, International Trade, Labour, National Accounts, Economic Indicators, Productivity, Prices and PPP, Taxation and Regulation, Transportation, and more. Each category has subcategories. The data is easily downloadable and viewable within the website."
Our World in Data,https://ourworldindata.org/,Data Sites,,Global,,,"Data on poverty, disease, hunger, climate change, war, existential risks, and inequality (and dozens of other topics. They write many articles on many different topics and are a trusted source of data for the top universities and news outlets around the world."
World Resources Institute,https://www.wri.org/,Data Sites,,Global,,,"A global research organization that focuses on Food, Forests, Water, Energy, Climate, the Ocean and Cities. Hundreds of data sets on many environmental and natural resource topics."
JPal US Data,https://www.povertyactionlab.org/admindatacatalog,Data Sites,,US,,,A well organized dataset search site for data in the US and Canada for many economic sectors and socioeconomic data. The website is aimed towards poverty data but there is substantial overlap with environmental data.
Geographic Information System Socioeconomic Data,https://gis.ucar.edu/data/socioeconomic,GIS,,Global,,,"Locating spatial data and information available through Internet servers or GIS data clearinghouses. Data include Climate Change Scenarios, Extreme Heat Climate maps, and other Climate data. The website also has useful tutorials on learning how GIS works."
Earth Data from Nasa,https://earthdata.nasa.gov/learn/pathfinders/covid-19/environmental-impacts,GIS,,Global,,,"Similar to the GIS data from the GIS Socioeconomic Data but with global information for air quality, nighttime light, water quality, biological diversity, and socioeconomic data. This is an excellent source to verify reported data from other sources. The Data Pathfinder is extremely useful to find data on specific questions like Health and Air Quality Data, Biological Diversity and Ecological Forecasting Data, and Agriculture and Water Resources data."
Environmental Protection Agency Economic Resources,https://www.epa.gov/environmental-economics/environmental-economic-resources,Data Sites,,US,,,"Datasets and Reports on pollution data in the USA for pollution (Air quality, hazardous waste, non-attainment areas, clear air Markets and more). The website has useful information on regulations, policies, criteria, and goals from the EPA."
United States Environmental Protection Agency,https://edg.epa.gov/metadata/catalog/main/home.page,Data Sites,,US,,,"The EPA has data on precipitation (don't use rain as an instrument), US temperature, basin boundaries, glaciers, heat-related hospitalizations, unusual temperatures in each region, environmental justice, and more. The data is available at the national and some regional levels. The website is mostly descriptive and some data sources may be hosted on other websites or through other agencies."
Statistics Canada,https://www150.statcan.gc.ca/n1/en/type/data?MM=1,Data Sites,,Canada,,,"Statistics Canada provides hundreds of datasets on various socioeconomic and environmental datasets. Data can be searched for by geography, frequency, subject, and by survey."
Natural Resources Canada,https://www.nrcan.gc.ca/earth-sciences/geography/atlas-canada/explore-our-data/16892,Data Sites,,Canada,,,"Natural Resources stores data and maps of Canada for various environmental variables. There is substantial overlap with Statistics Canada but more datasets relating to industry effects on the environment, Nature, Parks, and more."
SHRUG (compilation of India datasets),https://www.devdatalab.org/shrug,Data Sites,,India,,,"Dozens of datasets that cover 500,000 villages in India and 8000 towns for over 25 years. Data variables are predominately socioeconomic data."
Data for Good from Meta,https://dataforgood.facebook.com/,Data Sites,,Global,,,"Meta (Facebook) data that can be used to track populations, population density, mobility, connections, electrical and network coverage, economic poverty, business trends, other information collected by Meta. The data for climate conversations and CrowdTangle can be used to analyze public discussion on climate change, environmentalism, and economics."
Open datasets for Machine Learning,https://medium.com/datadriveninvestor/the-50-best-public-datasets-for-machine-learning-d80e9f030279,Data Catalog,,Global,,,"A site that helps you navigate other dataset sites and helps find datasets for machine learning. There are many sites listed, some of which are environmental and/or economics related. Importantly, this website can help you learn how to do machine learning which you may apply to other situations."
Google Dataset Search,https://datasetsearch.research.google.com/,Data Catalog,,Global,,,"Google Search for datasets with filters on what type of dataset, topics, format, usage rights, and updated information date."
UToronto Education Data List,https://guides.library.utoronto.ca/edu-data/edu-data-canadian,Data Catalog,,Canada,,,A brief and non-exhaustive catalog of Canadian data sources.
Plamen Nikolov's Useful Datasets for Development Economics Research,https://users.nber.org/~nikolovp/studentresources/datasets.pdf,Data Catalog,,Global,,,"A detailed list of micro and macro datasets for international, US, and UK data. Each dataset listed is described with Regions, data type (usually panel) and a 1 sentence description of the data available."
Yale Law - 75 Sources of Economic Data,https://library.law.yale.edu/news/75-sources-economic-data-statistics-reports-and-commentary,Data Catalog,,US,,,A website that looks much like this one with 75 links. The links are mostly to US department and Bureau websites for the US data with the addition of a few international sites. This site is may be useful if you are looking for environmental laws or regulations in the US.
Data in Economic History (Giuliano and Matranga 2020),https://www.nber.org/system/files/working_papers/w27967/w27967.pdf,Data Catalog,,Global,,,"A working paper that methodically explains where and how to find historical data for economics. From the abstract ""I...[W]e provide a comprehensive analysis of the types of historical data most commonly used in economic research and discuss a variety of issues that they raise, such as the constant change in national and administrative borders; the reshuffling of ethnic groups due to migration, colonialism, natural disasters, and many other forces. We also point out which methodological advances allow economists to overcome or minimize these problems."" If you are can not find data and are unsure of where it might be, this article is worth reading."
Our World in Data Electricity Generation,https://ourworldindata.org/grapher/electricity-generation,Energy,,Global,1985,2021,"Data from 1985 to 2021 on country and continent energy production for every country in the world. Our World in Data also has the cost of renewable energy, renewable energy by country, renewable energy produced by source, and many other data sets on energy."
U.S. Energy Information Administration (EIA),"https://www.eia.gov/energyexplained/electricity/electricity-in-the-us.php#:~:text=Most%20electricity%20is%20generated%20with,wind%20turbines%2C%20and%20solar%20photovoltaics.",Energy,,US,1950,2020,U.S. electricity generation data by source from 1950 to 2020.
Hourly Electric Grid Monitor (EIA),https://www.eia.gov/electricity/gridmonitor/dashboard/daily_generation_mix/US48/US48,Energy,,US,2018,2022,Hourly electricity production data for each state by electricity source. Data is available from 2018-2022.
Sea Around Us,http://www.seaaroundus.org/data/#/eez,Ocean,,Global,1950,2022,"This database estimates marine extractions for each country from 1950–present. The data can be disaggregated by industrial, artisanal, recreational, or subsistence sectors, by taxon, and by reported vs. unreported."
NOAA Commercial Fisheries Statistics,https://www.st.nmfs.noaa.gov/commercial-fisheries/,Ocean,,US,,,The National Oceanic and Atmospheric Administration (NOAA) maintains US fisheries landings and trade statistics. Additional US trade data is available through the US Census data portal.
UN Food and Agriculture: Fisheries and Aquaculture,https://www.fao.org/fishery/en/statistics/collections,Ocean,,Global,,,"Global statistics on aquaculture production, fishing capture, number of fishers, as well as data specific the regions such as Eastern Central Atlantic, Mediterranean, Southeast Atlantic, and others."
Climate Canada Historical Climate Data,http://climate.weather.gc.ca/,Weather,,Canada,1840,2022,"Data for Canadian weather from 1840 to 2022. Data is available at the Provincial level by weather station. Monthly normals, averages, and extremes are available from 1940 to 2010."
US NOAA Climate Data Online,http://www.ncdc.noaa.gov/cdo-web,Weather,,US,1901,2022,"U.S. local (land based) and global (coastal, oceanographic, geophysical, and climate) data for normals, temperature, precipitation. Data is available from 1901 to 2022 for many datasets."
Princeton gridded weather data,http://hydrology.princeton.edu/data.pgf.php,Weather,,Global,1901,2012,"This dataset provides near-surface meteorological data for driving land surface models and other terrestrial modeling systems. It blends reanalysis data with observations and disaggregates in time and space. The dataset is currently available at 1.0 degree (plus 0.5 and 0.25 degree), 3-hourly (plus daily and monthly) resolution globally for 1948-2008. Experimental updates include a 1901-2012 version (that will become V2), real-time updates, higher resolution versions for Africa (that assimilates all available gauge data) and future climate projections based on bias-corrected climate model output."
Berkeley Earth weather data,http://berkeleyearth.org/data/,Weather,,Global,1750,2022,"The datasets presented here have been divided into three categories: Output data, Source data, and Intermediate data. Data is available from 1750 for monthly land, 1833 for high and low temperature, and 1850 for monthly land+ ocean."
WorldClim,https://www.worldclim.org/,Weather,,Global,,,Global climate layers (gridded climate data) with a spatial resolution of about 1 km.
Pangeo weather and climate data,https://mldata.pangeo.io/#,Weather,,Global,,,"A mix of processed and raw files, includes historical (gridded) data and projections."
BC Air Quality Data,https://www2.gov.bc.ca/gov/content/environment/air-land-water/air/air-quality/current-air-quality-data,Pollution,Air,British Columbia,,,Air quality and particulate levels from BC monitoring stations across the province. Some datasets are over 2 GB to use and may be difficult or time consuming to open or clean.
US EPA Air Quality Data,https://www.epa.gov/outdoor-air-quality-data,Pollution,Air,US,1980,2020,"Data on particulates, pollution, wind direction, lead and more from 1980."
US EPA Air Markets Program Data,https://ampd.epa.gov/ampd/,Pollution,Air,US,1995,2022,"Emissions data by month, quarter, allowance transactions, allowance holdings, compliance, and SMOKE data from 1995 onwards."
EU EEA Air Pollution Data,https://www.eea.europa.eu/themes/air/explore-air-pollution-data,Pollution,Air,Europe,1969,2022,"Air quality data from 1969 (very limited), 1976 (somewhat limited) and 1990 (complete) onwards. Filtering by country, city, area, pollution type, year, pollution level are available. There is also a working map viewer (many other sites have them that do not work or barely work)."
London Air Quality Data (LAEI),https://data.london.gov.uk/air-quality/,Pollution,Air,London,2006,2022,High quality and very small area data for each London borough's air quality from 2006.
ProPublic Industrial Air Pollution Data (RSEI),https://www.propublica.org/article/were-releasing-the-data-behind-our-toxic-air-analysis,Pollution,Air,US,2014,2018,2014-2018 data on hot-spot zones in the US for cancer-causing industrial air pollution.
Canada National Long-term Water Quality Monitoring Data,https://open.canada.ca/data/en/dataset/67b44816-9764-4609-ace1-68dc1764e9ea,Pollution,Water,Canada,2000,2022,Various major water bodies in Canada pollution data from 2000 onwards.
USGS Water Quality Data,https://water.usgs.gov/owq/data.html,Pollution,Water,US,1995,2022,"Water quality data from 1995 onwards for river, lake, and coastal water pollution and quality data. Data is available through data sets and GIS shapefiles."
Freshwater ecosystems explorer,https://www.shttps://cfpub.epa.gov/ecotox/dg661.app/,Pollution,Water,Global,1984,2019,Global GIS data and time series data for all administrative areas and basins level 6. This dataset tracks all long-term changes in water-related ecosystems. This is an excellent resource. Data is for 1984-2019.
ECOTOX Knowledgebase,https://cfpub.epa.gov/ecotox/,Pollution,Water,US,,,"A Knowledgebase providing single chemical environmental toxicity data on aquatic life, terrestrial plants and wildlife. They track 12,485 chemicals across 13,709 species (plants and animals). Database has an excellent search function."
ECOTOX Models,https://www.ecotoxmodels.org/resources/databases/,Pollution,Water,US,,,"Lists of various models for the effects of pesticides, ECOTOX data, chemical properties, biodiversity, health from pesticides, and much more."
Eutrophication & Hypoxia Map Data Set,https://www.wri.org/data/eutrophication-hypoxia-map-data-set,Pollution,Water,Global,,,762 coastal areas impacted by eutrophication and/or hypoxia. Data is global and spans many decades depending on the country and site.
Global Biodiversity Information Facility,https://www.gbif.org/,Data Sites,Biodiversity,Global,,,"68,121 datasets on biodiversity on Global and local biodiversity."
Biological Diversity and Ecological Forecasting Data (NASA),https://earthdata.nasa.gov/learn/pathfinders/biodiversity,Biodiversity,,Global,,,"Forecasts for various climate change, ecological, biodiversity, water quality, green house gases, and other data available in data sets and GIS data."
Migratory Bird (USGS),https://www.usgs.gov/centers/patuxent-wildlife-research-center/science/migratory-birds,Biodiversity,,US,,,Data on migratory birds for various years in various regions of the U.S.
North American Breeding Bird Survey,https://www.pwrc.usgs.gov/bbs/,Biodiversity,,US & Canada,1960,2022,Breeding Bird data for the U.S. and Canada for over 400 bird species from the 1960s onward.
Biotime Database,https://biotime.st-andrews.ac.uk/,Biodiversity,,Global,,,"Global database of various time series for quantifying and understanding biodiversity change. Diversity in marine, terrestrial, and freshwater realms. There are hundreds of studies and millions of records."
International Disaster Database (EMDAT),https://www.emdat.be/,Natural Disasters,,Global,,,"Geophysical, Meteorological, Extreme Temperature, Hydrological, Climatological, Biological, Extraterrestrial (Space weather), Industrial accidents, transport accidents."
Hurricanes (HURDAT),https://www.nhc.noaa.gov/data/,Natural Disasters,,US,1958,2022,Hurricanes and cyclones in the US from 1958 onwards
Disaster Information Management System (DESINVENTAR),https://www.desinventar.net/,Natural Disasters,,Global,,,"The Administration and Data Entry module is a relational and structural database through which the database is fed by filling in predefined fields (space and temporal data, types of events and causes, sources) and by both direct and indirect effects (deaths, houses, infrastructure, economic sectors). The Analysis module allows access to the database by queries that may include relations among the diverse variables of effects, types of events, causes, sites, dates, etc. This module allows at the same time to represent those queries with tables, graphics and thematic maps. Data is mostly for developing countries and has a wide range of periods available depending on the country of interest."
NRCAN - Earthquakes,https://earthquakescanada.nrcan.gc.ca/stndon/NEDB-BNDS/index-en.php,Natural Disasters,,Canada,1600,2022,Earthquakes in Canada from the 16th century onwards
USGS - Earthquakes,https://www.usgs.gov/programs/earthquake-hazards/data,Natural Disasters,,US,1995,2022,U.S. earthquake from 1995 onwards and earthquake scenarios. Other data is available. More data may be available elsewhere on US earthquakes.
Inter-university Consortium for Political and Social Research(Open ICPSR),https://www.openicpsr.org/openicpsr/project/100167/version/V19/view;jsessionid=878E7D3C00D6B3A4072101B17FAA2A09,Beliefs,,US,2008,2022,Survey data on beliefs from 2008 onwards on Energy and the Environment in the U.S.
Questionnaire on Environment Statistics (UN),https://unstats.un.org/unsd/envstats/questionnaire,Beliefs,,Global,2004,2020,Surveys conducted biennially from 2004-2020 in countries without their own survey (Not for OECD or Eurostat countries).
The Global Resources Dataset (Mike Denly),https://mikedenly.com/datasets/global-resources-dataset,Resources,,Global,1988,2022,"Time-varying, spatial natural resource dataset that covers 197 resources in 116 countries (predominantly developing countries). Data starts in 1988 in some locations."
"EPA Facts and Figures on Materials, Wastes and Recycling",https://www.epa.gov/facts-and-figures-about-materials-waste-and-recycling/studies-summary-tables-and-data-related,Waste,,US,1960,2018,"Reports on Waste, recycling, composting, food waste, landfills, electronic waste, and others at the state or county level depending on the dataset and from 1960-2018 depending on the variable."
StatCan Health Data,https://www.canada.ca/en/services/health/data.html,Health,,Canada,,,"Resources on the state of Canadians' health, including statistics, facts, reports and data. Data sets include exposure to chemicals, heavy metals, and other content related to environmental factors. Data is available for a different number of years for different datasets."
US HealthData,https://healthdata.gov/,Health,,US,,,Various data sets for health outcomes in the U.S. for a wide variety of health outcomes. Period of data availability ranges by dataset.
